Apollo 55000-327USA;Series 65A Photoelectric Smoke Detector;https://firealarm.com/product/apollo-55000-327usa/;$36.34;
Edwards EST SIGA-OSCD;Multisensor Smoke and CO Detector;https://firealarm.com/product/edwards-est-siga-oscd/;$208.59;
Edwards EST SIGA-CT1;Single Input Module, UL/ULC Listed;https://firealarm.com/product/edwards-est-siga-ct1/;$58.59;
Simplex 4098-9714;TrueAlarm Photoelectric Smoke Sensor;https://firealarm.com/product/simplex-4098-9714/;$47.59;
Edwards EST SIGA-OSD;Intelligent Optical Smoke Detector;https://firealarm.com/product/edwards-est-siga-osd/;$81.54;
Bosch Security D9127U;POPIT input module without tamper No Tamper...;https://firealarm.com/product/bosch-security-d9127u/;$27.99;
System Sensor HWL-LF;Low Frequency Sounder, Wall, White;https://firealarm.com/product/system-sensor-hwl-lf/;$64.67;
Apollo 45681-250;E-Z Fit Base;https://firealarm.com/product/apollo-45681-250-e-z-fit-base/;$15.25;
Siemens OP121;Conventional Photoelectric Smoke Detector;https://firealarm.com/product/siemens-op121/;$55.99;
Vesda E700-SP;Miniature Sampling Point, package quantity of 10;https://firealarm.com/product/vesda-e700-sp/;$20.83;
Apollo 45681-256USA;Series 65A 4" Auxiliary Relay Base;https://firealarm.com/product/apollo-45681-256usa-series-65a-auxiliary-relay-base/;$36.39;
Honeywell FP280;External Probe for Flood Sensing;https://firealarm.com/product/honeywell-fp280/;$26.99;
System Sensor C58-227-01;;https://firealarm.com/product/system-sensor-c58-227-01/;0;
Honeywell IDP-PHOTO-IV;Ivory, low-profile intelligent photoelectric sensor;https://firealarm.com/product/honeywell-idp-photo-iv/;$102.48;
Notifier FSP-951;White, low-profile intelligent photoelectric sensor, FlashScan only;https://firealarm.com/product/notifier-fsp-951/;$73.08;
Gentex GHLFW;24 VDC Low Frequency Audible Signal;https://firealarm.com/product/gentex-ghlfw/;$63.35;
System Sensor CO-REPL;Replacement CO cell for COSMO-2W and COSMO-4W...;https://firealarm.com/product/system-sensor-co-repl/;$70.65;
Apollo 45681-251USA;Series 65A E-Z Fit Detector Base, 6";https://firealarm.com/product/apollo-45681-251usa/;$12.56;
Edwards EST G1T-FIRE;Genesis Trim Plate, White, "FIRE" Marking;https://firealarm.com/product/edwards-est-g1t-fire/;$4.86;
Simplex 4098-9792;TrueAlarm Standard Sensor Base;https://firealarm.com/product/simplex-4098-9792/;$42.57;
Potter LFH-24W;White 520 HZ Low Freq Sounder;https://firealarm.com/product/potter-lfh-24w/;$57.29;
Edwards EST G1R-HD;Genesis Temporal Horn, Red, No Marking, Selectable...;https://firealarm.com/product/edwards-est-g1r-hd/;0;
Apollo 45681-258USA;Series 65A 24 V End-of-Line Relay Base;https://firealarm.com/product/apollo-45681-258usa/;$39.19;
Kidde KI-SB;Standard Detector Mounting Base;https://firealarm.com/product/kidde-ki-sb/;$5.87;
Apollo 38531-771;Blank XPERT Card;https://firealarm.com/product/apollo-38531-771-blank-xpert-card/;$2.09;
Edwards EST SIGA-OSHD;Intelligent Multisensor Smoke and Heat Detector;https://firealarm.com/product/edwards-siga-oshd/;$97.24;
Edwards EST SIGA-SB4;4-inch Detector Mounting Base c/w SIGA-TS4 Trim...;https://firealarm.com/product/edwards-est-siga-sb4/;$14.00;
Siemens DB-11;Low-Profile Surface-Mount Base;https://firealarm.com/product/siemens-db-11/;$11.91;
Notifier FSP-951-IV;Ivory, Low-Profile Intelligent Photoelectric Sensor;https://firealarm.com/product/notifier-fsp-951-iv/;$146.43;
Wheelock ELSPSTRC;Speaker Strobe, Red, "FIRE" Lettering, Ceiling Mount;https://firealarm.com/product/wheelock-elspstrc/;$98.45;
Simplex 2099-9822;Replacement retaining clip for breakglass;https://firealarm.com/product/simplex-2099-9822/;$1.39;
Edwards EST G1AVRF;Horn-Strobe, Red, "FIRE" Marking, Selectable Candela, High/low...;https://firealarm.com/product/edwards-est-g1avrf/;$76.99;
System Sensor 5601P;Mechanical Heat Detector; Single Circuit, 135°F (57°C),...;https://firealarm.com/product/system-sensor-5601p/;$29.39;
Gentex GX91-W;12/24VDC Low Current Mini-Horn;https://firealarm.com/product/gentex-gx91-w/;0;
Apollo 58000-650APO;Photoelectric Smoke Detector;https://firealarm.com/product/apollo-58000-650apo/;0;
Notifier FSP-851;Low-Profile Intelligent Photoelectric Sensor;https://firealarm.com/product/notifier-fsp-851/;$132.99;
Advanced 58000-650ADV;AX Photoelectric Smoke Detector;https://firealarm.com/product/advanced-58000-650adv/;0;
Hochiki SOC-24V;Conventional Photoelectric Smoke Detector;https://firealarm.com/product/hochiki-soc-24v/;$54.59;
Simplex 4098-9733;Heat Sensor;https://firealarm.com/product/simplex-4098-9733/;$28.17;
System Sensor B300-6;6" Flanged Mounting Base, White;https://firealarm.com/product/system-sensor-b300-6/;$10.49;
Gamewell XP95-P;XP95A Photoelectric Smoke Detector;https://firealarm.com/product/gamewell-xp95-p/;0;
Edwards EST SIGA-278;Double Action (One Stage) Fire Alarm Station,...;https://firealarm.com/product/edwards-est-siga-278/;$109.19;
Air Products & Controls MB-SDR-XP95;Analog Addressable XP95 Sounder Base;https://firealarm.com/product/air-products-controls-mb-sdr-xp95/;$26.00;
Siemens FP-11;Addressable FirePrint Detector;https://firealarm.com/product/siemens-fp-11/;$665.00;
Advanced 55000-830ADV;AX Mini Priority Switch Monitor Module;https://firealarm.com/product/advanced-55000-830adv/;0;
Simplex 4081-9005;End-of-Line Resistor Harness, 1.8 kΩ, 1/2 W;https://firealarm.com/product/simplex-4081-9005/;$11.54;
Potter PAD100-6DB;6" Addressable Detector Base;https://firealarm.com/product/potter-pad100-6db/;$19.59;
Apollo 55000-227USA;Series 65A Ionization Smoke Detector;https://firealarm.com/product/apollo-55000-227usa/;$89.90;
Notifier FMM-1;Intelligent Monitor Module with FlashScan;https://firealarm.com/product/notifier-fmm-1/;$57.40;
Honeywell IDP-PHOTO-W;White, Low-Profile Intelligent Photoelectric Sensor;https://firealarm.com/product/honeywell-idp-photo-w/;$79.80;
Interlogix 260-CO;Carbon monoxide detector, alarm & trouble relays,...;https://firealarm.com/product/interlogix-260-co/;$121.76;
Macurco GD-2B;Natural Gas (NG) or Propane (LP) Detector;https://firealarm.com/product/macurco-gd-2b/;$160.29;
Kidde KI-SB4;Standard Detector Mounting Base w/ 4-inch Trim...;https://firealarm.com/product/kidde-ki-sb4/;$13.90;
Edwards Signaling GCHFWF-S2;High Fidelity Speaker, White, "FIRE" Marking, 25V,...;https://firealarm.com/product/edwards-signaling-gchfwf-s2/;$31.68;
Hochiki HSB-224;Smoke Detector Base;https://firealarm.com/product/hochiki-hsb-224-smoke-detector-base/;0;
Hochiki NS6-224;Conventional Detector Base, 2-Wire, 6", 24VDC;https://firealarm.com/product/hochiki-ns6-224/;$9.79;
Fire-Lite SD365-IV;Ivory, Low-Profile Intelligent Photoelectric Sensor;https://firealarm.com/product/fire-lite-sd365-iv/;$219.79;
System Sensor 5251H;High temperature thermal detector;https://firealarm.com/product/system-sensor-5251h/;$72.17;
System Sensor 4WTAR-B;4-wire photo, thermal sound, 50mA;https://firealarm.com/product/system-sensor-4wtar-b/;$104.99;
Edwards EST SIGA-HRD;Intelligent Fixed Temperature / Rate-of-Rise Heat Detector;https://firealarm.com/product/edwards-est-siga-hrd/;$62.99;
Simplex 4098-9788;2-Wire Base with connections for Remote Alarm...;https://firealarm.com/product/simplex-4098-9788/;$14.60;
Simplex 4098-9601;TrueAlarm Photoelectric Detector;https://firealarm.com/product/simplex-4098-9601-truealarm-photoelectric-detector/;$76.99;
Vesda VSP-962;VESDA-E VEU/VEP/VES Filter (single cartridge);https://firealarm.com/product/vesda-vsp-962/;$193.19;
Simplex 4098-9858;TrueAlarm Duct Sensor Sampling Tube, 97";https://firealarm.com/product/simplex-4098-9858/;$71.39;
Gamewell-FCI MCS-COF3-IV;Advanced Multi-Criteria Fire/CO detector, Velociti, Ivory;https://firealarm.com/product/gamewell-fci-mcs-cof3-iv/;$324.79;
Edwards EST G1RT-FIRE;Genesis Trim Plate, Red, "FIRE" Marking;https://firealarm.com/product/edwards-est-g1rt-fire/;$8.39;
Silent Knight IDP-HEAT-IV;Low-Profile Intelligent 135°F Fixed Thermal Sensor, Ivory;https://firealarm.com/product/silent-knight-idp-heat-iv/;$93.97;
System Sensor EOLR-1;End of Line Supervision Relay;https://firealarm.com/product/system-sensor-eolr-1/;$32.17;
System Sensor DNR;Intelligent Non-Relay Photoelectric Low-Flow Duct Smoke Detector;https://firealarm.com/product/system-sensor-dnr/;$225.13;
System Sensor MDL3R;Sync-circuit module, 12/24 volt, red;https://firealarm.com/product/system-sensor-mdl3r/;$114.44;
Notifier NBG-12L;Conventional Dual-Action Pull Station;https://firealarm.com/product/notifier-nbg-12l-conventional-dual-action-pull-station/;$57.39;
Edwards EST SIGA-TS4;Trim Skirt (supplied with 4-inch bases);https://firealarm.com/product/edwards-est-siga-ts4/;$2.77;
System Sensor SWL-CLR-ALERT;Wall Strobe, White, "ALERT" Marking;https://firealarm.com/product/system-sensor-swl-clr-alert/;$88.39;
System Sensor SBBWL;Wall Surface Mount Back Box, White;https://firealarm.com/product/system-sensor-sbbwl/;$26.00;
System Sensor B501-WHITE;4" Flangeless mounting base, White;https://firealarm.com/product/system-sensor-b501-white/;$10.08;
System Sensor 2W-B;i3 Photoelectric Smoke Detector, 2-Wire;https://firealarm.com/product/system-sensor-2w-b/;$69.99;
Gentex GHLFR;24 VDC Low Frequency Audible Signal;https://firealarm.com/product/gentex-ghlfr/;$63.35;
Kidde KIR-PD;Intelligent Optical Smoke Detector;https://firealarm.com/product/kidde-kir-pd/;$37.84;
Potter PAD100-RM;Relay Module;https://firealarm.com/product/potter-pad100-rm/;$93.10;
Air Products & Controls SM-501-P;Photoelectric Conventional Duct Detector;https://firealarm.com/product/air-products-controls-sm-501-p/;$186.19;
Edwards EST SIGA-MCC1;Single Input Signal Module (UIO Mount) -...;https://firealarm.com/product/edwards-est-siga-mcc1/;$107.79;
Hochiki ALN-V;Photoelectric Smoke Sensor;https://firealarm.com/product/hochiki-aln-v/;$72.79;
System Sensor COSMO-2W;12/24 volt, 2-wire, system-connected, combination carbon monoxide/smoke...;https://firealarm.com/product/system-sensor-cosmo-2w/;$154.73;
System Sensor B200SR-LF-WH;Low-frequency sounder base (compatible with B501BH series),...;https://firealarm.com/product/system-sensor-b200sr-lf-wh/;$167.99;
Edwards EST SIGA-PD;Intelligent Optical Smoke Detector;https://firealarm.com/product/edwards-est-siga-pd/;$83.99;
Notifier FST-951R-IV;Ivory, low-profile intelligent rate-of-rise fixed thermal sensor,...;https://firealarm.com/product/notifier-fst-951r-iv/;$121.49;
RSG Security 211 Key;211 Key;https://firealarm.com/product/rsg-security-211-key/;0;
Viking VK2001 / 19922AB;VK2001 - Standard Response Upright Sprinkler (K8.0);https://firealarm.com/product/viking-vk2001-19922ab/;$10.42;
Chemetronics 601;Heat Detector, No Marking, Single Circuit, Rate-of-Rise...;https://firealarm.com/product/chemtronics-601/;0;
Edwards EST SIGA-CR;Control Relay Module (Standard Mount);https://firealarm.com/product/edwards-est-siga-cr/;$79.11;
Simplex 4098-9747;CO Replacement Cartridge;https://firealarm.com/product/simplex-4098-9747-co-replacement-cartridge/;$186.40;
Edwards EST SIGA-HFD;Intelligent Fixed Temperature Heat Detector;https://firealarm.com/product/edwards-est-siga-hfd/;$75.59;
Edwards EST SIGA-HRS;Intelligent Fixed Temperature / Rate-of-Rise Heat Detector;https://firealarm.com/product/edwards-est-siga-hrs/;0;
System Sensor SBBSPRL;Surface Mount Back Box, Red, wall-mount, compatible...;https://firealarm.com/product/system-sensor-sbbsprl/;$26.60;
Silent Knight SD500-MIM;Addressable Mini Input Module;https://firealarm.com/product/silent-knight-sd500-mim/;$103.25;
Notifier FRM-1;Addressable Relay Module with FlashScan;https://firealarm.com/product/notifier-frm-1/;$79.80;
Wheelock MT-24MCW-NW;Multitone Horn Strobe, Xenon, Wall, White, No...;https://firealarm.com/product/wheelock-mt-24mcw-nw/;$97.36;
Interlogix 702RU;Detector Base;https://firealarm.com/product/interlogix-702ru/;0;
Thermotech 302-EPM-135;Heat Detector — Rate Compensation, Explosion Proof Mounting,...;https://firealarm.com/product/thermotech-302-epm-135/;$83.85;
Notifier FMM-101;Miniature Monitor Module;https://firealarm.com/product/notifier-fmm-101/;$52.78;
Edwards EST SIGA-CRH;High Power Control Relay Module;https://firealarm.com/product/edwards-est-siga-crh/;$106.04;
RSG Security PK625 KEY ONLY;Pull Station PK625 Key Only ;https://firealarm.com/product/rsg-security-pk625-key-only/;$1.19;
Edwards EST SIGA-CT2;Dual Input Module;https://firealarm.com/product/edwards-est-siga-ct2-dual-input-module/;$102.19;
Kidde EGCAVWF;Horn/Strobe, Ceiling Mount, 24V DC, "FIRE" Marking,...;https://firealarm.com/product/kidde-egcavwf/;$86.39;
Edwards EST SIGA-PCD;Multisensor Smoke and Carbon Monoxide (CO) Detector;https://firealarm.com/product/edwards-est-siga-pcd/;0;
Gamewell-FCI AOM-2SF;Addressable Output Supervised Control Module;https://firealarm.com/product/gamewell-fci-aom-2sf/;$118.57;
Silent Knight IDP-RELAY;Addressable Relay Module;https://firealarm.com/product/silent-knight-idp-relay/;$109.62;
System Sensor RTS151KEY;Remote Test Station with Key;https://firealarm.com/product/system-sensor-rts151key/;$97.99;
Edwards EST SIGA-270;One Stage Fire Alarm Station, English Markings...;https://firealarm.com/product/edwards-est-siga-270/;$104.99;
Gamewell-FCI AMM-2F;Addressable Miniature Monitor Module;https://firealarm.com/product/gamewell-fci-amm-2f/;$71.39;
Edwards GS 6250B;Ionization Smoke Detector;https://firealarm.com/product/edwards-gs-6250b/;$270.00;
Edwards EST SIGA-SD;Intelligent Duct Smoke Detector;https://firealarm.com/product/edwards-est-siga-sd/;$228.19;
Edwards EST SIGA-SB;Detector Mounting Base;https://firealarm.com/product/edwards-est-siga-sb/;$11.03;
RSG Security DHE4APC;4" Adjustable Extension Rod, Powder Coated, Chrome;https://firealarm.com/product/rsg-security-dhe4apc/;$20.99;
Gamewell-FCI AOM-2RF;Addressable Output Relay Control Module;https://firealarm.com/product/gamewell-fci-aom-2rf/;$114.11;
Bosch Security LVF-5005C-S0940;Varifocal SR Megapixel Lens 9-40mm Varifocal SR...;https://firealarm.com/product/bosch-security-lvf-5005c-s0940/;$56.92;
Silent Knight SK-FIRE-CO-W;Advanced Multi-Criteria Fire/CO Detector, White;https://firealarm.com/product/silent-knight-sk-fire-co-w/;$306.59;
Edwards EST SIGA-UIO6R;Universal Input-Output Module Board w/ Riser Inputs...;https://firealarm.com/product/edwards-est-siga-uio6r/;$145.59;
Mircom MIX-2251AP;Intelligent Photoelectric Smoke Sensor;https://firealarm.com/product/mircom-mix-2251ap/;0;
Apollo 55000-250;Series 60A Conventional Ionization Smoke Detector;https://firealarm.com/product/apollo-55000-250/;0;
Vesda VSP-878;Push-in Connect Adaptor Kit for 1⁄2” capillary...;https://firealarm.com/product/vesda-vsp-878/;$27.99;
Edwards EST 757A-SB;Surface Box, Red, Indoor;https://firealarm.com/product/edwards-est-757a-sb/;$13.02;
Edwards EST 757A-SB-W;Surface Box, White, Indoor;https://firealarm.com/product/edwards-est-757a-sb-w/;$13.02;
Edwards EST G4VWN;Strobe, White, No Marking;https://firealarm.com/product/edwards-est-g4vwn/;$41.30;
Edwards EST SIGA-PHS;Intelligent 3D Multisensor Detector;https://firealarm.com/product/edwards-est-siga-phs/;$85.95;
Edwards EST 757-7A-SS70W;Speaker-Strobe, 70V, 15/75cd, White;https://firealarm.com/product/edwards-est-757-7a-ss70w/;$132.59;
Notifier FPTI-951;Multi-criteria photoelectric, thermal and infrared smoke detector,...;https://firealarm.com/product/notifier-fpti-951/;$105.80;
Space Age Electronics ELOCK-FA;ELOCK Circuit Lockout Kit;https://firealarm.com/product/space-age-electronics-elock-fa/;$14.85;
Wheelock AS-24MCW-FR;Audible Strobe, Red, "FIRE" Marking, Wall Mount,...;https://firealarm.com/product/wheelock-as-24mcw-fr/;$98.00;
Edwards Signaling GCHFWN-S7VMC;High Fidelity Speaker-Strobe, White, No Marking, Selectable...;https://firealarm.com/product/edwards-signaling-gchfwn-s7vmc/;0;
System Sensor LENS-B;;https://firealarm.com/product/system-sensor-lens-b/;$18.74;
Simplex 4090-9001;Supervised IAM, mounted in thermoplastic housing w/...;https://firealarm.com/product/simplex-4090-9001/;$51.79;
Notifier FST-851;Intelligent Thermal Detector;https://firealarm.com/product/notifier-fst-851/;0;
Siemens FDO421;Photoelectric Smoke Detector;https://firealarm.com/product/siemens-fdo421/;$99.39;
Kidde KI-PD;Intelligent Optical Smoke Detector;https://firealarm.com/product/kidde-ki-pd/;$55.05;
System Sensor 5603;Mechanical Heat Detector; Single Circuit, 135°F (57°C),...;https://firealarm.com/product/system-sensor-5603/;$23.79;
Wheelock ELSTWC;Eluxa LED Ceiling Strobe, White, "FIRE" Text;https://firealarm.com/product/wheelock-elstwc/;$55.31;
Vesda E700-TUBE;Polyethylene tubing, black. 1/2" OD x 3/8"...;https://firealarm.com/product/vesda-e700-tube/;$197.39;
Kidde EGCVWF;Strobe, Ceiling Mount, 24V DC, "FIRE" Marking,...;https://firealarm.com/product/kidde-egcvwf/;$79.79;
System Sensor TR300;Trim ring, White;https://firealarm.com/product/system-sensor-tr300/;$7.70;
Simplex 4906-9128;TrueAlert Horn with Multi-Candela Strobe, Ceiling Mount,...;https://firealarm.com/product/simplex-4906-9128/;$130.19;
System Sensor B300-6-IV;6" Flanged Mounting Base, Ivory;https://firealarm.com/product/system-sensor-b300-6-iv/;$13.66;
System Sensor SBBCWL;Ceiling Surface Mount Back Box, White;https://firealarm.com/product/system-sensor-sbbcwl/;$30.59;
Edwards Signaling 270-GLR;Replacement Glass Rods, 20 Count;https://firealarm.com/product/edwards-signaling-270-glr/;$20.99;
Simplex 4081-9004;End-of-Line Resistor Harness, 6.8 kΩ, 1/2 W ;https://firealarm.com/product/simplex-4081-9004/;$9.10;
Gamewell-FCI ASD-PL3R;Photoelectric smoke detector, remote test capable, for...;https://firealarm.com/product/gamewell-fci-asd-pl3r/;$77.28;
Edwards EST 405-7A-TW;Harsh Environment Strobe, 15/75 cd, White;https://firealarm.com/product/edwards-est-405-7a-tw/;$75.39;
Simplex 4090-9051;Supervised Addressable Module;https://firealarm.com/product/simplex-4090-9051/;$68.59;
Simplex 4098-9756;Duct Sensor Housing with supervised multiple relay...;https://firealarm.com/product/simplex-4098-9756/;$245.99;
Notifier FSP-951R-IV;Ivory, low-profile intelligent photoelectric sensor, remote test...;https://firealarm.com/product/notifier-fsp-951r-iv/;$191.79;
Edwards Signaling EG1AVWN;Horn Strobe, Selectable Candela, White, No Marking;https://firealarm.com/product/edwards-signaling-eg1avwn/;$60.93;
Simplex 4906-9127;TrueAlert Horn with Multi-Candela Strobe;https://firealarm.com/product/simplex-4906-9127/;$99.39;
SOLO A10;Aerosol Smoke, Single Can;https://firealarm.com/product/solo-a10/;$41.99;
Simplex 4098-9717;TrueAlarm Ionization Smoke Sensor;https://firealarm.com/product/simplex-4098-9717/;0;
Costar 12-24SIR;Carbon Monoxide Detector;https://firealarm.com/product/costar-12-24sir/;$106.68;
Apollo 55000-830USA – Used;Mini Priority Switch Monitor Module;https://firealarm.com/product/apollo-55000-830usa-used/;$26.00;
Edwards EST 757-8A-T-W;Temporal Horn-Strobe, 110cd, White;https://firealarm.com/product/edwards-est-757-8a-t-w/;$119.70;
Fire-Lite SD365;White, low-profile intelligent photoelectric sensor, LiteSpeed only;https://firealarm.com/product/fire-lite-sd365/;$81.19;
Simplex 2081-9044;Overvoltage Protector;https://firealarm.com/product/simplex-2081-9044/;$48.69;
Honeywell IDP-PHOTO-R-IV;Ivory, low-profile intelligent photoelectric sensor, remote test...;https://firealarm.com/product/honeywell-idp-photo-r-iv/;$121.90;
System Sensor M500M;Intelligent Monitor Module;https://firealarm.com/product/system-sensor-m500m-monitor-module/;$87.08;
Edwards EST SIGA-LED;Remote LED Alarm Indicator;https://firealarm.com/product/edwards-est-siga-led-remote-led-alarm-indicator/;$15.40;
Hochiki FRCME-P;Fast Response Contact Monitoring Module;https://firealarm.com/product/hochiki-frcme-p/;$74.19;
Kidde KI-OSD;Intelligent Optical Smoke Detector;https://firealarm.com/product/kidde-ki-osd/;$46.77;
Apollo 55000-830USA;Mini Priority Switch Monitor Module;https://firealarm.com/product/apollo-55000-830usa/;$58.79;
Fire-Lite SB-I/O;Surface Mount Back Box;https://firealarm.com/product/fire-lite-sb-i-o/;$14.87;
EST 1551F;Ionization Sensor;https://firealarm.com/product/est-1551f/;0;
Wheelock ELSPSTR;Speaker Strobe, Red, "FIRE" Lettering, Wall Mount;https://firealarm.com/product/wheelock-elspstr/;$98.45;
Gamewell-FCI XP95-T;Analog Addressable Thermal Sensor;https://firealarm.com/product/gamewell-fci-xp95-t/;$60.19;
Apollo 55000-650APO;XP95A Photoelectric Smoke Detector;https://firealarm.com/product/apollo-55000-650apo/;0;
Edwards Signaling GCHFWF-S7VMC;High Fidelity Speaker-Strobe, White, "FIRE" Marking, Selectable...;https://firealarm.com/product/edwards-signaling-gchfwf-s7vmc/;$64.65;
Notifier FCO-951;Advanced Multi-Criteria Fire/CO Detector, FlashScan, White, UL...;https://firealarm.com/product/notifier-fco-951/;$223.43;
Edwards EST 3-LCD;Liquid Crystal Display Module;https://firealarm.com/product/edwards-est-3-lcd/;$294.08;
System Sensor D4120;Duct Smoke Detector, 4-Wire, Photoelectric Type;https://firealarm.com/product/system-sensor-d4120/;$317.79;
Hochiki NS4-224;Conventional Detector Bases, 2-Wire, 4", 24VDC;https://firealarm.com/product/hochiki-ns4-224/;$8.29;
Edwards EST SIGA-CC1S;Synchronization Output Module (Standard Mount);https://firealarm.com/product/edwards-est-siga-cc1s/;$167.99;
Notifier FST-951;White, low-profile intelligent 135° fixed thermal sensor,...;https://firealarm.com/product/notifier-fst-951/;$71.39;
Apollo 55000-226USA;Series 65A Ionization Smoke Detector with Flashing...;https://firealarm.com/product/apollo-55000-226usa/;0;
Edwards 757A-SBW;Surface box, white, indoor;https://firealarm.com/product/edwards-757a-sbw/;$20.99;
Kidde KIR-OSCD;Multisensor Smoke and CO Detector;https://firealarm.com/product/kidde-kir-oscd/;$138.59;
Siemens OP921;Photoelectric Smoke Detector;https://firealarm.com/product/siemens-op921-photoelectric-smoke-detector/;$92.39;
Notifier NP-200-IV;Ivory, Low-Profile Intelligent Photoelectric Sensor;https://firealarm.com/product/notifier-np-200-iv/;$132.15;
System Sensor SPSCWL;Ceiling Mount Speaker Strobe, White, "FIRE" Marking;https://firealarm.com/product/system-sensor-spscwl/;$93.88;
Edwards EST SMXLO2;Plug-In Standard Output Single Mode Transceiver for...;https://firealarm.com/product/edwards-est-smxlo2/;$906.86;
SOLO A7;Air Detector Duster;https://firealarm.com/product/solo-a7/;$27.86;
Apollo 55000-806USA;XP95A Priority Switch Monitor Module;https://firealarm.com/product/apollo-55000-806usa/;0;
Edwards EST 405-7A-T;Harsh Environment Strobe, 15/75 cd, Red;https://firealarm.com/product/edwards-est-405-7a-t/;$110.59;
Silent Knight SK-HEAT-HT-W;Low-Profile Intelligent 190°F Fixed Thermal Sensor, White;https://firealarm.com/product/silent-knight-sk-heat-ht-w/;$71.81;
Gamewell-FCI MS-7S;Single action station, wire leads;https://firealarm.com/product/gamewell-fci-ms-7s/;$37.79;
Hochiki SLR-24V;Photoelectric Smoke Detector;https://firealarm.com/product/hochiki-slr-24v/;0;
Kidde EG4AVWF;Horn-Strobe, White, "FIRE" Marking;https://firealarm.com/product/kidde-eg4avwf/;$72.56;
Gamewell-FCI DACT-E3;Dialer Card for E-3/S-3 Fire Alarm Panels;https://firealarm.com/product/gamewell-fci-dact-e3/;$475.99;
Notifier FST-951H-IV;Ivory, low-profile intelligent 190°F thermal sensor, FlashScan...;https://firealarm.com/product/notifier-fst-951h-iv/;$124.46;
Edwards EST 757-8A-T;Temporal Horn-Strobe, 110cd, Red;https://firealarm.com/product/edwards-est-757-8a-t/;$170.79;
Edwards EST G1TW;Trim Ring, G1 Series, White;https://firealarm.com/product/edwards-est-g1tw/;$4.86;
System Sensor M501M;Mini Monitor Module;https://firealarm.com/product/system-sensor-m501m/;0;
System Sensor 2400;Photo Detector, 2-wire, 12/24 VDC;https://firealarm.com/product/system-sensor-2400/;0;
Kidde GCWA-VMC;Genesis Ceiling Strobe, Selectable Candela, Clear Lens,...;https://firealarm.com/product/kidde-gcwa-vmc/;$73.49;
Siemens DI-3 – Refurbished;Ionization Smoke Detector;https://firealarm.com/product/siemens-di-3-refurbished/;$253.39;
Notifier PSE-6;6.0 A, 120 VAC remote charger power...;https://firealarm.com/product/notifier-pse-6/;$516.00;
Apollo 55000-327USA;Series 65A Photoelectric Smoke Detector;https://firealarm.com/product/apollo-55000-327usa/;$36.34;
Edwards EST SIGA-OSCD;Multisensor Smoke and CO Detector;https://firealarm.com/product/edwards-est-siga-oscd/;$208.59;
Edwards EST SIGA-CT1;Single Input Module, UL/ULC Listed;https://firealarm.com/product/edwards-est-siga-ct1/;$58.59;
Simplex 4098-9714;TrueAlarm Photoelectric Smoke Sensor;https://firealarm.com/product/simplex-4098-9714/;$47.59;
Edwards EST SIGA-OSD;Intelligent Optical Smoke Detector;https://firealarm.com/product/edwards-est-siga-osd/;$81.54;
Bosch Security D9127U;POPIT input module without tamper No Tamper...;https://firealarm.com/product/bosch-security-d9127u/;$27.99;
System Sensor HWL-LF;Low Frequency Sounder, Wall, White;https://firealarm.com/product/system-sensor-hwl-lf/;$64.67;
Apollo 45681-250;E-Z Fit Base;https://firealarm.com/product/apollo-45681-250-e-z-fit-base/;$15.25;
Siemens OP121;Conventional Photoelectric Smoke Detector;https://firealarm.com/product/siemens-op121/;$55.99;
Vesda E700-SP;Miniature Sampling Point, package quantity of 10;https://firealarm.com/product/vesda-e700-sp/;$20.83;
Apollo 45681-256USA;Series 65A 4" Auxiliary Relay Base;https://firealarm.com/product/apollo-45681-256usa-series-65a-auxiliary-relay-base/;$36.39;
Honeywell FP280;External Probe for Flood Sensing;https://firealarm.com/product/honeywell-fp280/;$26.99;
System Sensor C58-227-01;;https://firealarm.com/product/system-sensor-c58-227-01/;0;
Honeywell IDP-PHOTO-IV;Ivory, low-profile intelligent photoelectric sensor;https://firealarm.com/product/honeywell-idp-photo-iv/;$102.48;
Notifier FSP-951;White, low-profile intelligent photoelectric sensor, FlashScan only;https://firealarm.com/product/notifier-fsp-951/;$73.08;
Gentex GHLFW;24 VDC Low Frequency Audible Signal;https://firealarm.com/product/gentex-ghlfw/;$63.35;
System Sensor CO-REPL;Replacement CO cell for COSMO-2W and COSMO-4W...;https://firealarm.com/product/system-sensor-co-repl/;$70.65;
